{
  "html_locale": null,
  "title": "text",
  "type": "text",
  "data_raw": {
    "date": "April 14, 2026, 6:34 PM",
    "content": "Well i didn't know about this",
    "duration": null,
    "length": null
  },
  "data_preview": {
    "date": "2026.04.14 18:34",
    "content": "Well i didn't know about this",
    "duration": null,
    "length": "29 chars"
  }
}
