{
  "html_locale": null,
  "title": "reaction",
  "type": "reaction",
  "data_raw": {
    "date": "Tuesday 10:25pm",
    "content": null,
    "duration": null,
    "length": null
  },
  "data_preview": {
    "date": "2026.05.19 22:25",
    "content": null,
    "duration": null,
    "length": null
  }
}
