{
  "html_locale": null,
  "title": "video-call",
  "type": "video-call",
  "data_raw": {
    "date": "11:14 AM",
    "content": "video call",
    "duration": "00:31:00",
    "length": null
  },
  "data_preview": {
    "date": "2026.05.27 11:14",
    "content": "video call",
    "duration": "00:31:00",
    "length": null
  }
}
