{
  "html_locale": null,
  "title": "video-link",
  "type": "video-link",
  "data_raw": {
    "date": "11:57 AM",
    "content": "https://youtube.com/shorts/IKS2vNOcZ7A?si=ly12c89dzPEHyhll",
    "duration": null,
    "length": null
  },
  "data_preview": {
    "date": "2026.05.27 11:57",
    "content": "youtube_com/shorts/IK...",
    "duration": null,
    "length": null
  }
}
