{
  "html_locale": null,
  "title": "audio-call",
  "type": "audio-call",
  "data_raw": {
    "date": "April 12, 2026, 1:23 PM",
    "content": "Audio call 18 mins",
    "duration": "18 mins",
    "length": null
  },
  "data_preview": {
    "date": "2026.04.12 13:23",
    "content": "Audio call 18 mins",
    "duration": "00:18:00",
    "length": null
  }
}
