{
  "html_locale": null,
  "title": "image",
  "type": "image",
  "data_raw": {
    "date": "Wednesday 7:51pm",
    "content": null,
    "duration": null,
    "length": null
  },
  "data_preview": {
    "date": "2026.05.20 19:51",
    "content": "image sent",
    "duration": null,
    "length": null
  }
}
