{
  "html_locale": null,
  "title": "text",
  "type": "text",
  "data_raw": {
    "date": "12:26 AM",
    "content": "Do you have that photo and a link?",
    "duration": null,
    "length": null
  },
  "data_preview": {
    "date": "2026.05.23 00:26",
    "content": "Do you have that photo and a link?",
    "duration": null,
    "length": "34 chars"
  }
}
