{
  "html_locale": null,
  "title": "voice-note",
  "type": "voice-note",
  "data_raw": {
    "date": "12:00 PM",
    "content": "0:21",
    "duration": "00:00:21",
    "length": null
  },
  "data_preview": {
    "date": "2026.05.27 12:00",
    "content": "voice note",
    "duration": "00:00:21",
    "length": null
  }
}
