{
  "html_locale": null,
  "title": "missed-call",
  "type": "missed-call",
  "data_raw": {
    "date": "Thursday 5:34pm",
    "content": "Missed audio call",
    "duration": null,
    "length": null
  },
  "data_preview": {
    "date": "2026.05.14 17:34",
    "content": "Missed audio call",
    "duration": null,
    "length": null
  }
}
