{
  "html_locale": null,
  "title": "missed-call",
  "type": "missed-call",
  "data_raw": {
    "date": "11:15 AM",
    "content": "video call",
    "duration": null,
    "length": null
  },
  "data_preview": {
    "date": "2026.05.24 11:15",
    "content": "video call",
    "duration": null,
    "length": null
  }
}
