{
  "html_locale": null,
  "title": "text",
  "type": "text",
  "data_raw": {
    "date": "April 16, 2026, 10:55 AM",
    "content": "I now realised what happened. It must have been related to reviewers I added at a later stage from when we wen through that, and maybe I was duplicating and editing a reviewer who had the cancellation option on",
    "duration": null,
    "length": null
  },
  "data_preview": {
    "date": "2026.04.16 10:55",
    "content": "I now realised what happened. It must have been related to reviewers I added at a later stage from when we wen through that, and maybe I was duplicating and editing a reviewer who had the cancellation option on",
    "duration": null,
    "length": "210 chars"
  }
}
