{
  "html_locale": null,
  "title": "voice-note",
  "type": "voice-note",
  "data_raw": {
    "date": "Wednesday 7:52pm",
    "content": "0:20",
    "duration": "00:00:20",
    "length": null
  },
  "data_preview": {
    "date": "2026.05.20 19:52",
    "content": "voice note",
    "duration": "00:00:20",
    "length": null
  }
}
