{
  "html_locale": null,
  "title": "link",
  "type": "link",
  "data_raw": {
    "date": "Friday 1:51pm",
    "content": "Pinned Location Hall Mead Nursery, Nazeing Road Waltham Abbey England EN9 2EU United Kingdom",
    "duration": null,
    "length": null
  },
  "data_preview": {
    "date": "2026.05.15 13:51",
    "content": "https://www.google.com/maps/search/?api=1&query=Hall%20Mead%20Nursery%2C%20Nazeing%20Road%20Waltham%20Abbey%20England%20EN9%202EU%20United%20Kingdom",
    "duration": null,
    "length": null
  }
}
